File;Original;közvetlen;fordított
138.ogg;Resume mopping.;Folytatom a felmosást.;Folytassa a felmosást.
139.ogg;Resume returning to the base for self-cleaning.;A dokkolóhoz tartottam megtisztítani magam.;Folytassa az alapra való visszatérést öntisztításhoz.
140.ogg;New environment is detected. Returning to the self-wash base.;Úgy látom új helyen vagyok. Visszamegyek a bázisra.;Új környezet észlelése. Visszatérés az önmosó bázisra.
141.ogg;Mop pad error. Please check and clean it.;Felmosó hiba. Kérlek, ellenõrizd és tisztítsd meg.;Mop pad hiba. Kérjük, ellenõrizze és tisztítsa meg.
142.ogg;Mop pad worn out. Please replace it timely.;A felmosóbetét elhasználódott. Kérlek, cseréld amint tudod.;A felmosóbetét elhasználódott. Kérjük, idõben cserélje ki.
143.ogg;Cleaning completed.;Kész vagyok a takarítással.;A tisztítás befejezõdött.
144.ogg;Mopping completed.;Kész vagyok a felmosással.;A felmosás befejezõdött.
145.ogg;Positioning successful. Resume cleaning.;Már tudom hol vagyok. Folytatom a takarítást.;Pozicionálás sikeres. Folytassa a takarítást.
146.ogg;Positioning successful. Resume mopping.;Már tudom hol vagyok. Folytatom a felmosást.;Pozicionálás sikeres. Folytassa a felmosást.
148.ogg;Return to the base for self-cleaning.;Megyek vissza a bázisra megtisztítani magam.;Vissza a bázisra az öntisztításhoz.
149.ogg;Unable to reach the specified area. Please try to clear obstacles in the path.;Nem sikerült elérni a megadott területet. Kérlek, próbáld meg eltakarítani az útban lévõ akadályokat.;Nem sikerült elérni a megadott területet. Kérjük, próbálja meg eltakarítani az útban lévõ akadályokat.
150.ogg;Unable to reach the specified area. Please try to delete no-go zones in the path.;Nem sikerült elérni a megadott területet. Kérlek, próbáljd meg törölni a tiltott zónákat az útvonalon.;Nem sikerült elérni a megadott területet. Kérjük, próbálja meg törölni a tiltott zónákat az útvonalon.
151.ogg;The path is blocked. Please try to clear obstacles around your robot.;Az útvonal el van zárva. Kérlek, próbáld meg a körülöttem lévõ akadályokat eltávolítani.;Az útvonal el van zárva. Kérjük, próbálja meg a robot körüli akadályokat eltávolítani.
152.ogg;The path is blocked. Please try to delete no-go zones or move your robot out of this area.;Az útvonal el van zárva. Kérlek, próbáld meg törölni a tiltott zónákat, vagy vigyél ki a területrõl.;Az útvonal el van zárva. Kérjük, próbálja meg törölni a tiltott zónákat, vagy vigye ki a robotot a területrõl.
153.ogg;Your robot is detected in the no-go zone. Please move your robot out of this area.;A robotodat a tiltott zónában észlelték. Kérjük, vigye ki robotját errõl a területrõl.;A robotodat a tiltott zónában észlelték. Kérjük, vigye ki robotját errõl a területrõl.
154.ogg;Operated too frequently. Please try again later.;Túl gyakran próbáltad. Kérjük, próbálja meg késõbb újra.;Túl gyakran mûködött. Kérjük, próbálja meg késõbb újra.
155.ogg;Start to return to the charging and the mop cleaning dock.;Indítsa el, hogy visszatérjen a töltéshez és a moptisztító dokkolóhoz.;Indítsa el, hogy visszatérjen a töltéshez és a moptisztító dokkolóhoz.
156.ogg;Mop pad tray uninstalled.;A felmosópad tálcát eltávolították.;A felmosópad tálcát eltávolították.
157.ogg;Am already at the charging and the mop cleaning dock.;Már a töltõ és tisztító dokkolónál vagyok.;Már a töltõ- és a moptisztító dokkolónál vagyok.
200.ogg;Shutdown sound;Kikapcsolási hang;Kikapcsolási hang
179.ogg;Mop pad cleaned, the water in the clean water tank insufficient, please fill the clean water tank and empty the used water tank;Felmosók megtisztítva. Úgy tûnik elfogyott a tiszta víz, kérlek tültsd újra és ellenõrizd a szennyezett vízet is.;Mop pad megtisztítva, a tiszta víztartályban lévõ víz nem elegendõ, kérjük, töltse ki a tiszta víztartályt és ürítse ki a használt víztartályt.
181.ogg;Low water, please fill the clean water tank;A vízszint nem megfelelõ, kérlek ellenõrizd a tiszta víztartályt.;
186.ogg;Please check the clean water tank;Kérlek ellenõrizd a tiszta víztartályt.;
187.ogg;This will take about 5-10 minutes;Ez 5, 10 percig is eltarthat.;
188.ogg;Automatic docking engaged;Automatikus dokkolás;
